{
  "pacing": "director",
  "run_duration": 1200,
  "tier_duration": 300,
  "ranged_start": 600,
  "scaling": {
    "adaptive_clear_pressure_strength": 0.0,
    "grace_seconds": 180,
    "health_growth_per_120_seconds": 1.16,
    "damage_growth_per_second": 0.0004,
    "minimum_spawn_interval": 0.1,
    "maximum_enemies": 160,
    "opening_spawn_interval": 3.0,
    "spawn_growth_start_seconds": 180.0,
    "spawn_phases": [{"start": 0, "pressure": "light", "interval": 4}, {"start": 25, "pressure": "heavy", "interval": 1}, {"start": 50, "pressure": "medium", "interval": 2}, {"start": 65, "pressure": "light", "interval": 4}, {"start": 85, "pressure": "heavy", "interval": 1}, {"start": 105, "pressure": "medium", "interval": 2}],
    "spawn_cycle_seconds": 120,
    "day_spawn_phases": [{"start": 0, "pressure": "light", "interval": 4, "floor": 0.35, "growth": 0.3}, {"start": 30, "pressure": "heavy", "interval": 1.4, "floor": 1.0, "growth": 1.0}, {"start": 55, "pressure": "medium", "interval": 2.4, "floor": 0.7, "growth": 0.85}, {"start": 70, "pressure": "light", "interval": 4, "floor": 0.35, "growth": 0.3}, {"start": 100, "pressure": "heavy", "interval": 1.25, "floor": 1.0, "growth": 1.0}, {"start": 130, "pressure": "medium", "interval": 2.2, "floor": 0.7, "growth": 0.85}, {"start": 145, "pressure": "light", "interval": 4, "floor": 0.35, "growth": 0.3}, {"start": 175, "pressure": "heavy", "interval": 1.1, "floor": 1.0, "growth": 1.0}, {"start": 205, "pressure": "medium", "interval": 2, "floor": 0.7, "growth": 0.85}, {"start": 220, "pressure": "light", "interval": 4, "floor": 0.35, "growth": 0.3}, {"start": 245, "pressure": "heavy", "interval": 0.95, "floor": 1.0, "growth": 1.0}, {"start": 275, "pressure": "light", "interval": 4, "floor": 0.35, "growth": 0.3}],
    "xp_multiplier": 1.6,
    "spawn_growth_factor": 1.28,
    "spawn_difficulty_points": [
      {"time": 0, "multiplier": 1.0},
      {"time": 60, "multiplier": 1.15},
      {"time": 180, "multiplier": 1.6},
      {"time": 300, "multiplier": 2.4},
      {"time": 480, "multiplier": 4.0},
      {"time": 660, "multiplier": 4.5}
    ],
    "maximum_spawn_difficulty": 4.5,
    "spawn_batch_points": [
      {"time": 0, "count": 1.0},
      {"time": 300, "count": 1.5},
      {"time": 660, "count": 2.0},
      {"time": 1200, "count": 3.0}
    ],
    "endless_batch_growth_per_120_seconds": 0.5,
    "spawn_growth_period_seconds": 180,
    "spawn_batches": [
      {
        "difficulty": 1.0,
        "count": 1
      }
    ]
  },
  "bosses": [
    {
      "time": 300,
      "variant": "juggernaut",
      "name": "The Gatekeeper",
      "health": 1200
    },
    {
      "time": 600,
      "variant": "charger",
      "name": "The Pursuer",
      "health": 1800
    },
    {
      "time": 900,
      "variant": "shieldbearer",
      "name": "The Iron Guard"
    }
  ],
  "variants": {
    "pursuer": {
      "name": "Pursuer",
      "family": "grunt",
      "unlock_time": 0,
      "health": 30,
      "speed": 90,
      "damage": 8,
      "xp": 10,
      "weight": 100,
      "size": 0.85,
      "sprite": "res://assets/typecast/Slime Enemies/Slime boi 1.png",
      "visual_scale": 2.28965
    },
    "sprinter": {
      "name": "Sprinter",
      "family": "runner",
      "unlock_time": 12,
      "health": 12,
      "speed": 270,
      "damage": 6,
      "xp": 6,
      "weight": 50,
      "size": 0.65,
      "sprite": "res://assets/typecast/Slime Enemies/Slime boi 2.png",
      "visual_scale": 2.177525
    },
    "flanker": {
      "name": "Flanker",
      "family": "grunt",
      "unlock_time": 120,
      "health": 32,
      "speed": 72,
      "damage": 10,
      "xp": 7,
      "weight": 22,
      "size": 0.85,
      "sprite": "res://assets/typecast/Slime Enemies/Slime boi 1 sprout.png",
      "visual_scale": 2.497685
    },
    "skirmisher": {
      "name": "Skirmisher",
      "family": "grunt",
      "unlock_time": 180,
      "health": 30,
      "speed": 85,
      "damage": 10,
      "xp": 7,
      "weight": 18,
      "size": 0.85,
      "sprite": "res://assets/typecast/Slime Enemies/Slime boi 1 flower.png",
      "visual_scale": 2.60176
    },
    "swarmer": {
      "name": "Swarmer",
      "family": "runner",
      "unlock_time": 240,
      "health": 9,
      "speed": 150,
      "damage": 4,
      "xp": 3,
      "weight": 20,
      "size": 0.65,
      "sprite": "res://assets/typecast/Slime Enemies/Slime girl 1.png",
      "visual_scale": 1.633115
    },
    "juggernaut": {
      "name": "Juggernaut",
      "family": "brute",
      "unlock_time": 300,
      "health": 135,
      "speed": 38,
      "damage": 24,
      "xp": 18,
      "weight": 12,
      "size": 1.25,
      "sprite": "res://assets/typecast/Slime Enemies/Slime boi 4.png",
      "boss_sprite": "res://assets/typecast/Slime Enemies/King Slime.png",
      "visual_scale": 2.76,
      "boss_visual_scale": 1.721895
    },
    "charger": {
      "name": "Charger",
      "family": "runner",
      "unlock_time": 360,
      "health": 15,
      "speed": 110,
      "damage": 14,
      "xp": 8,
      "weight": 15,
      "size": 0.65,
      "sprite": "res://assets/typecast/Slime Enemies/Slime boi 3.png",
      "boss_sprite": "res://assets/typecast/Slime Enemies/King Slime 2.png",
      "boss_charge": {
        "speed_multiplier": 3.8,
        "speed": 600.0,
        "duration": 1.0,
        "trigger_range": 700.0,
        "warning": 0.9,
        "cooldown": 3.5
      },
      "visual_scale": 2.721935,
      "boss_visual_scale": 2.95665
    },
    "shieldbearer": {
      "name": "Shieldbearer",
      "family": "brute",
      "unlock_time": 420,
      "health": 95,
      "speed": 45,
      "damage": 18,
      "xp": 15,
      "weight": 12,
      "size": 1.25,
      "sprite": "res://assets/typecast/Slime Enemies/Slime boi 6 tophat.png",
      "boss_sprite": "res://assets/typecast/Slime Enemies/King Slime 2.png",
      "visual_scale": 2.97229,
      "boss_visual_scale": 1.90647
    },
    "slammer": {
      "name": "Slammer",
      "family": "brute",
      "unlock_time": 480,
      "health": 110,
      "speed": 42,
      "damage": 18,
      "xp": 18,
      "weight": 10,
      "size": 1.25,
      "sprite": "res://assets/typecast/Slime Enemies/Slime boi 5.png",
      "visual_scale": 3.18458
    },
    "marksman": {
      "name": "Marksman",
      "family": "shooter",
      "unlock_time": 600,
      "health": 32,
      "speed": 55,
      "damage": 14,
      "xp": 12,
      "weight": 12,
      "size": 0.85,
      "sprite": "res://assets/typecast/Wisp Enemies/will-o-wisp 1.png",
      "visual_scale": 3.908505
    },
    "fan_caster": {
      "name": "Fan Caster",
      "family": "shooter",
      "unlock_time": 660,
      "health": 38,
      "speed": 48,
      "damage": 12,
      "xp": 14,
      "weight": 10,
      "size": 0.85,
      "sprite": "res://assets/typecast/Wisp Enemies/forest spirit.png",
      "visual_scale": 4.05881
    },
    "mortar": {
      "name": "Mortar",
      "family": "shooter",
      "unlock_time": 720,
      "health": 45,
      "speed": 40,
      "damage": 20,
      "xp": 16,
      "weight": 8,
      "size": 0.85,
      "sprite": "res://assets/typecast/Slime Enemies/Slime boi 6 tophat.png",
      "visual_scale": 3.01806
    }
  },
  "contact_recoil": {
    "duration": 0.24,
    "speed": 320.0,
    "heavy_multiplier": 0.6,
    "boss_multiplier": 0.35
  },
  "recycling": {
    "entry_margin": 160,
    "distance_beyond_view": 600,
    "maximum_per_check": 2
  },
  "wave_spacing": 0.35,
  "waves": [
    {
      "time": 210,
      "variant": "skirmisher",
      "count": 8
    },
    {
      "time": 255,
      "variant": "swarmer",
      "count": 12
    },
    {
      "time": 390,
      "variant": "swarmer",
      "count": 14
    },
    {
      "time": 480,
      "variant": "flanker",
      "count": 10
    },
    {
      "time": 690,
      "variant": "swarmer",
      "count": 16
    },
    {
      "time": 810,
      "variant": "charger",
      "count": 10
    },
    {
      "time": 990,
      "variant": "swarmer",
      "count": 18
    },
    {
      "time": 1110,
      "variant": "skirmisher",
      "count": 12
    }
  ]
}
